"model laura work south america kidnap hotel room gang jungl demand huge ransom releas peter hire safe bonu bring monei well girl peter jungl helicopt friend jack kidnapp fake monei return laura plan horribl wrong bail helicopt helicopt shot bail well roam jungl devil sort realiti nake black gui weirdli big ey breath problem start kill kidnapp laura escap captur primit rest film bit blur reallybr br massiv jess franco fan fact second film best effort film drag pretti slow pace happen thing edit easili minut tv plenti overli long shot peopl walk jungl lift straight outbr br devil hunter lit infact lit badli dub slow reason bore main reason hilari bad scene exampl scene laura walk street shot real street crowd peopl stare straight camera shoot funni scene gang kill hung tree drip blood friend stand directli scream minut reason man tree head fall hit gui believ cours actual devil nake black gui despit fact massiv ey blurri visionbr br film hook video nasti scare uk ban idea gore shock film minu nuditi pg thing watch origin list word mouthbr br reason watch film massiv jess franco fan plenti nuditi keep fall asleep scene bad good laugh wise pai ticket south america lost jungl funbr br",negative
"art film nation film preserv foundat imdb exact film definit appear indic gener time periodwith camerawork pop art style pure late searli sbr br film consist three simpl imag distort weird camera trick distort imag accompani music absolut dialog plot sort intend form perform art perform art interest tiresom film bluntli total bore appeal film famili friend peopl hip understood mortal",negative
"iberia nice tv silver screen lot danc music classic music modern danc movi half hour long time skill danc silver screen better bollywood movi combin breath danc long movi director carlo saura shoot danc experi time time good movi hour time interest kind art bigger life film big",negative
"fanci horror flick vincent price plai mad magician realiz vocat talent sold devis wai aveng wrong master scheme fire himbr br price par compar masterpiec reason watch thriller support cast includ patrick neal mari murphi eva gabor jai novellobr br",negative
"jami foxx suppos funnydo funnywel funni watch confid funnyth man ident whatsoeveri idol denzel washington martin lawrenc hard imit moviesth problem bad uneven denzel machost attitud abruptli martin lawrenc funni clumsysilli comic person touch contribut person sell sure person dullboi personbr br hope hollywood black commun america find better launch super stardom don cheadl exampl pathet jami better repres gener remix",negative
"aw andi macdowel terribl actress wooden rock hors better job rememb turn equal excruci film portrai england full chocol box cottag villag green school school apart hogwart twee polic station set heartbeat nauseat british seri set sthi film couldn mind comedi seriou examin undercurr women friendship stuck graveyard sex scene highli stupid storm work scene work tragedi second half find implaus kate speak molli terribl behaviour final note decent actress staunton pile poo mention anna chancellor macdowel stick advertis wrinkl cream",negative
"michael jackson claim spot topbil charact golden child love kid work eddi murphi save rescu kid mida futur scriptwrit thoroughli studi actor inan dialogu quirki fantasi adventur comedi step closer ishtar murphi best wrong exquisit comic talent belong movi dr dolittl violenc visual combin reason stamp cult camp classic wouldn sens hollywood movi fanat cash gui speak visual pull amazingli well time ronald reagan presidenti fame murphi better america hr stale movi touch golden honei sweet crunchi tast",negative
"stori norman maclean masterwork redford film mediocr add banal scene maclean brother fall doubled seedi bar hint stori cipher brad pitt plai charismat paul maclean geniu outdoor prove risibl depress depend origin stori meant fly cast scene beauti tom skerritt father craig sheffer norman strong masculin men expect women impress film regrett maclean love women stori clear poetic",negative
"time movi jami foxx bet will fail funni peopl audienc thought funni face camera showerbr br plot complet predict bad gui good gui good gui woman bad gui offici screw final scene utterli unbeliev spend year dollar chase gui work solv trivial riddlebr br great plot storylin shoot mtv style wast monei onebr br",negative
"movi minut ramon concert period stupid absolut boredom kind high school anywaybr br major ramon fan repeat wast time utterli unwatch start finish movi call ramon fever appear movi plot flick teen comedi scrape bottom barrel",negative
"decent sequel pack punch origin murder screenwriterjudd nelsonassum ident order direct novel cabin lake ruthless kill movi tongueincheek humor funni kind total project qualiti quicki time nelson top movi script rewritten screenthi happen script",negative
"earli seri will evolv pilot thought potenti seri cours voyag thought potenti sore disappoint gut enterpris won bad voyag howeverbr br impress pilotbr br pilot good idea good theme introduct open credit interest progress explor fit theme song scott bakula excel role captainbr br fell short stori lack feel set grand adventur plot episod gener trek stori theme explor step space subplot subtext edit refer deep space mission plot hard differenti era enterpris tng central plot reflect justic grand theme seriesbr br plot launch mission grand action isol refer explor stori nostalg philosoph tv feel excit wind sea distract rescu plethora gunplai gunplaybr br feel human freshmen establish school kid block oppos ventur unknown univers sadli klingon land doorstep find meet histor sociolog societi interact hint itbr br trek akward crew limit technolog oppos brave step unknown newer fresher seri promis concept great conceptbr br will conclud reiter sentiment seri potenti interest charact bakula wonder blalock potenti theme interest kirk apollo futur episod justic grand wonder theme will will creat legendsbr br shoot arrow air good luck capt archerbr br produc risk",negative
"moviethi movi felt school specialsonli lower budget lower elsei guess suppos inspir movi sortbut work meyet preachyit pale shade flash dancebut whatther excit movieth dialogu contriv clich deathof courseth movi feel bad clich stellarthough lot actor givenor casenotto work withon top poor song choiceswith bad lyricsi felt embarrass actor involvedthei talentedbut moviethi opinion coursebut fly aka dream",negative
"prais movi film prepar possibl aw script lack film pointless side gener level craft actor technic crew compet sow ear work silk purs ben fan stick movi dorothi fan stick galaxina peter fan stick pictur target fan cheap laugh expens stick peter amazingli aw book kill unicorn",negative
"movi feel director portrai stori dictat style movi opposit type move wrote stori suit fail badli guess stylish movi movi total wast time effort credit director media work worst movi director maintain continu movi actor decent perform",negative
"well reason cinema sneak preview terribl teenag slasher movi scream scari movi seriou plot suck worst godzilla compar movi compet worst cinema onebr br plot hole stori girl alik kill care knew advanc denis talent actress bad excus moviebr br stai movi",negative
"burt kennedi good director lumber mess film cheap cheapmost battl scene lift superior command footag shot year contemporari pictur action scene shot movi disorgan confus incompet shoddi rest pictur feel bad student film budget lot move molass overthetop ham underthetop comatosealthough raul julia better rest castand chock full annoi histor inaccuraci top long bore film hour withdon stretch three hour good movi alamo check john wayn version film movi stole action scene hard produc movi lousi skip",negative
"movi beauti sceneri plot order plot conflict movi spent hour paint beauti scene fail place activ pictur artist fail pai attent fundament stori tellingbr br love montana sceneri fly fish will find film expect stori",negative
"film long minut problem jungl horror film footag peopl walk jungl rocki cliff river lake pad time film worth laughabl nake nativ zombi big bulg bloodi ey accompani soundtrack heavi breath lot reverb eurotrash fan will plenti entertain bad english dub gratuit femal flesh silli makeup job monster nativ extra zombiecannib flick pretti light gore uncut version",negative
"definit worst movi adam point life happi movi laugh fast forward button wast time movi suck",negative
"perfect murder foil wifeplai mari ellen trainor wife director robert zemecki helm episod murder husband poker misfortun receiv visitor move bodi outsidean escap insan madman dress santa clau suitplai devious hideou larri drake fend life find hide husband corps decid ax santa killer chanc chop woman head frame killer husband murder santa killer lock closet pursu woman daughter desper free save childbr br episod tale crypt recycl tire materi involv santa kill theme ad oftusedadd nauseumwomanmurdersherhusbandforamansh sbeencheatingwith routin essenti trainor find avoid caught dead bodi kill keep safe distanc maniac refresh plot pretti motion highlight",negative
"execut produc movi rememb correctli person rais financi movi notic great number movi star sean conneri execut produc meant conneri rais monei major player point great number movi star sean conneri sole manag rais monei major hollywood player indic credit read execut produc star movi movi star vehicl storyscreenplai scratch br br protocol saga sunni davi kooki bimboesqu cocktail waitress save visit dignitari reward top diplomat thing progress ms davi problem string sentenc find outlandish situat protocol star goldi hawn film execut produc understand storyscreenplai scratch exactli",negative
"movi flaw front portrai mytholog alamo histori product poor impress welfar project lot actor work hollywood squar greatest flaw ag gener person real alamo protagonist geriatr ensembl tv actor chosen portrai hint believ intrudebr br nativ texan grew mytholog learn histori accept decent product perspect prefer histor accuraci chanc enjoi john wayn fess parker version life stolid mess accuratebr br disappoint avoid",negative
"jami foxx favorit comedian feel sold order gain big budget lead role foxx footstep chri tucker martin lawrenc dave chappl talent wast stereotyp produc black male commit pretti crime funni concept monei talk blue streakbr br laugh time grant comedian continu pick hilari role love gui branch ala marlon wayan portray requiem dream live color tommi davidson damon wayan move perform spike lee satir bamboozl",negative
"stori man unnatur feel pig start open scene terrif exampl absurd comedi formal orchestra audienc turn insan violent mob crazi chant singer stai absurd time gener narr eventu era turn cryptic dialogu shakespear easi third grader technic level better good cinematographi futur great vilmo zsigmond futur star salli kirkland freder forrest",negative
"movi suck wast life atroci plot complet implaus long long stori short peopl terror pathet craze killer complet fail fight manner raft camp trip gear campsit assembl complet stock food cloth daughter headphon addition boat panic thei stuck wood daughter boyfriend consid hike wood movi suck complet joke girlfriend talk watch",negative
"contriv plot sens bad dialogu disjoint scene ultim downer bad peter falk find find john christma better left lost ms bertinelli perform depth emot costar william russ brother hank david cubitt love interest noah jennif pisana soccoro daughter singl dad noah unbear watch listen sing blame materi michael murrai script juvenil best br br year time search tv guid wait anxious classic christma inspir holidai film appear small screen film miracl street ernst lubitsch delight shop corner cours version scroog frank capra classic wonder life meet john doe hei forget classic holidai holli hunter great perform robert downei jr br br advic time better spent search film find find john christma merri christma",negative
"return cabin lake stand origin main charact stanlei return sequal film worth hour time huge fan film stori good movi will watch basic equal sequal urban legend blair witch wors person better soap opera piti laugh recommend movi watch will detract",negative
"killjoi brad syke respons dull clich film camp blood br br terribl print shoddi film scream serious better challeng satur youtub zombi crapbr br bought rememb price minut life well avoid turkei bargain basement price",negative
"understand perfectli devic univers translat translat microb creator realiz peopl earth time frame attilla hun wasn contemporari preliter hellen cultur vike contemporari pyramid builder speak languag develop languag modern dai englishexcept inflect influenc latin ancient greek danish french br br cultur differ overcom easili trust won team arriv welcom suspicion start order peopl appoint leader cours real fan comment perceiv god peopl meet shock technolog accus witchcraft likebr br histor background visual vagu remind greek vike cultur dress bunch tablecloth local costum rental plastic helmet horn claim smalltown theater group better propsbr br bore lame canuck product inexplic ten long year kid grade knowledg human behavior languag couldn bear watch twelv episod season decent scifi shut cleans comput refug minut",negative
"younger enjoi watch bad televis guilti time excus watch thing buck roger centuri silver spoon young naiv ignor worthwhilebr br thankfulli appreci good stuff stargat sg good yearold love hacknei bit stilt dialogu bit needless technobabbl write insipid bland uninspir star trek voyag long worst trek troublebr br film stargat wonder guilti pleasur anchor solid perform jame spader kurt russel full fascin egyptian architectur cultur wonder music score cool scifi idea origin music film fun appear richard dean anderson macgyv watchabl legend interest half asleep episodesbr br budget low set somebodi basement cinematographi better vanilla dull script amaz lot style farscap substanc reimagin battlestar galactica smaller rabid fanbas pap deserv",negative
"meant comedi seriou drama film start lightheart banter three women fine move conflict women meet man fine antic fine plot thicken final black start wonder misinterpret movi continu vein origin lightheart banter late hard women talk final unconvinc lesson british filmmak film difficult produc convinc film work box offic prove real flop heard film weekend year releas",negative
"premis movi explain pretend movi critic opinion movi low fan takashi miik categori great work doa manybr br movi free pass takashi film takashi wrong highschool approach cinema rest find hour half kid scream real reason complet annoi film pace film reach level rigomorti actingwellhmmm br br takashi fan peak interest lack origin neverend stori charact develop lead charact face conflict superfici br br point film miik credit cowrit hope miik person spill screen token miik shot vi director photographybr br movi potenti great premis difficult wild groundbr br miik standard gozu ichi audit movi work blue harp fudoh raini dog bird peopl china",negative
"terribl movi nuff saidbr br filler movi bad expand wast time warn avoid movi suck write moron bad nice thing movi deniz akkaya breast ruin terribl unneed rape scene movi contriv total unbeliev piec garbagebr br rag imdb stupid rule text minimum wast time watch offal feel compel warn creat account imdb discov write friggen essai film express bad total unnecessari",negative
"cast finer group actor find set director love york citi film woodi allen improv bogdonovich fall love find love manhattan place problem movi script actor fall love sight unnecessari director experi hollywood work set realiti peer fantasi real movi hollow shallow messageless",negative
"worst film kate jed bunch gui start clappingso hollywood bad scene kate hand pavement appear examin textur pavement andi bad film connect feel love women good overshadow andi campi movi type film couldn film situat andi help film gum lancom makeup putti knife glamor commer",negative
"goldi hawn film protocol walmart purchas mildli amus film hit stride scene parti scene bar long purposebr br cours preachi scene film film bad tast concern scene movi stupid comedi teach lesson written burn especiallybr br glad possess hawn movi sure worth monei paid",negative
"watch dvd origin languag english subtitl poor actual dialog stori charact develop hk star movi presenc better wors bad bright color scene cg attract sheer color brillianc overwhelm long child movi nonstop barrag cg fight scene crap plot grasp place film deliveri stori lousi",negative
"dude gui year shock kind wai horror joke wrong low budget laugh classic freak tod brown victim dracula frankenstein undi monster ernest thesig paul wegen golem passeng ghost train compar bad bad bad screenplai total waist monei free time watch lot movi horror time favorit speechless effort watch daft understand",negative
"middl ground watch rhine concern applaud sincer liber point view fine loath obviou propaganda mediocr dialogu cardboard charact tendenti fall categori film playconcern activ european refuge washington wartimea crush bore worthwhil intermitt author lillian hellman side angel irrelev plai written peopl share point view seldom explor idea weren held author audienc point dread side find percent agreement saya rhinei stand charact unreal ear dialogu facil peopl talk possess real brillianc origin thoroughli agre late mari mccarthi long overdu dismantl hellman reput year ago theatr dead extremi yearn good dai urg peek watch rhine bad angel america theatr foot grave sixti year ago",negative
"adventur buckaroo banzai big troubl china conan barbarian horribl film cool selfdeprec humor turn cult sensat golden child plain badbr br premis unwork funni moment eddi murphi flip attitud deflat feel tension danger stori special silli damag tension mystic secret tibetan buddhism lampoon drawn compelbr br feel stake charact face real danger carebr br filmbr br big fan eddi murphi help themselvesbr br elsebr br film occasion joke work",negative
"st watch dirbrad syke mindless movi flesheat zombi stori movi chronicl zombi eat human flesh wow time time zombi movi zombi movi better underli stori actual flesheat origin zombi classic good flesheat thrown extra bore chronicl lametwilightzon easili understood slowpacingli reveal final stori stori movi start withhav report investig socal ghost town cours flesh eat zombi well well watch classic borefeast",negative
"protocol implaus movi save grace star goldi hawn good cast support actor stori revolv ditzi cocktail waitress famou inadvert save life arab dignitari stori downhil halfwai movi goldi charm save movi goldi hawn fan film",negative
"adam sandlerbr br doubt idiot film cruis ship waiter shecki sandler comedian cruis ship funni clever entir movi honestli unfunni pathet surprisingli crude sexual humor fword plenti budget low ruin film place cruis ship monei rent small boat monei ship extra billi bob thornton open credit anim reeeeeaalli cheapli pathet hate movi will hate toobr br min rate languag",negative
"sooooo excit movi final read book week year son forward rent snuggl enjoi classic holidai stori brought life screenbr br boi disappoint movi veer book time forgiv georg scott excel actor fulli charact time rest time flatbr br realiz precg bmovi qualiti encount jacob marleybr br biggest disappoint fact left move stori spirit christma scroog whirlwind tour observ peopl bleakest circumst light love christmastimebr br will admit scott good job reform scroog refresh portrayalbr br bob cratchit portrai rag downtrodden tini tim start bad child actor",negative
"andi mcdowel beauti ish woman late start seriou relationship lead consider younger man subsequenet fallingout longtim best girldfriendsbr br gigologolddigg sincer young man girlfriend deadset termin silli relationship call duti help friend blind gigolo tricki gamebr br short success situat absolut ridicul fetch longer cover unbeliev scene hope sweet love stori viewer left involuntari shake head thing happen cliffhang detail warn viewer high expect film will disappoint scale rank weak better materi worth time",negative
"todai laugh vh sale rental vh movi refer list cover peter bogdanovich audrei hepburn john ritter special dorothi stratten attract price low decid risk bui search imdb user rate excel refer mick martin marsha porter video dvd guid wow star decid wast time finish watch laugh bore overr movi charact badli develop spent lot minut understand role stori plot suppos funni privat ey fall love women chase laugh stori coincid huge citi york ridicul ben gazarra attract seduct man women fall brad pitt antonio bandera georg cloonei ridicul greater attract presenc playboi centerfold playmat year dorothi stratten murder husband pretti releas movi life star death centerfold dorothi stratten stori amaz beauti sexi patti hansen futur keith richard wonder fiftytwo year audrei hepburn song amigo roberto carlo roberto carlo popular brazilian singer call fan king will keep movi collect attract manli dorothi stratten vote fourbr br titl brazil muito riso muita alegria laugh lot happi",negative
"swing film remain blackproduc film film simpli deterior badli unwatch fairli good shape nice chanc talent black perform period heydai cotton cluba time forgotten todaybr br film histor love perform mess main plot hollywood music erainclud prima donna ruin surpris unknown appear save dai write godaw bit trashi timesand project imag black america find bit demean plot treat noaccount bum live hard work wife popular stereotyp time caught hussi total overplai role fight scene wwe smackdown ladi cut ladi straight razora trashi scene film prima donna behav abomin husband punch face applaud film time appeal lowest common denomin audienc wellwith worst long timebr br lousi product trashi charact bad direct poor write worth peek excel sing tap dancinga well catch glimps forgotten black cultur warn actingit bad",negative
"film version sandra bernhard onewoman offbroadwai gaspingli pretenti sandra spoof loung superstar sens ironi fitfulli interest fitfulli funni fan will scathingli honest true shrill unapologet inyourfac bravado wellsuit film genr niceand friendsand rub lot peopl wrong meet halfwai materi serious lack filmmak nicola roeg serv execut produc direct film chilli detach signatur style bernhard cowrot director john boskovich oddest touch sandra inhous audienc complet boreda feel real viewer will share",negative
"jami foxx fun movi bad gui plai malkovichian charact fire cop will find bad gui cours good gui set bad gui set cop turn leaf",negative
"well goeth point pass neg judgement aspir object great la maman la putain sure pass histori influenc franc thirti year interest histori film dissuad watch express pure subject judgement feel compel disagre review post peopl watch wast hour time will leav feel sick angri sick angri human condit gener profound exactli critic adopt fulsom prais film ordeal watch ruthless dissect emot cowardic cruelti manag univers broadli relev messag sort director good reason satisfi pessimist conclus beef film hourslong record empti vaniti petti treacheri justifi excus gener relev messag three main charact deepli moral unattract individu alexandr greatest degre cours seldom shut thirti second mari degre alexandr pretenti monologu kind amus cours amus wear thin clearli realiz jeanpierr aud absurd remark homm beau comm film de nichola rai reproduc wordforword opinion accept authent profound milieu director eustach live ten year time film suppos tone relentless superfici trivial sustain film work long sardon comedi shallow worthless despic post milieu viewer extrem angri director grant lengthi scene alexandr veronika clearli expect empath feel share moral univers man live flat profess love woman sleep flat pari propos marriag third well suppos best luck dogeatdog chosen creat conscienc listen moment maudlin monologu speak anxieti despair doubl despic veronika barg drunk apart bed share mari alexandr behav infantil inconsist tantamount savag heartless cruelti la maman la putain intend portrait alexandr veronika mari three individu halfwai decent person admit compani suppos kind legitimaci prais director unflinch feel flinch conscious opt creat thoroughli repel charact filmic observ imagin problem director clearli convinc appear succeed convinc gener critic alexand veronika mari repres human gener limit human emot capabl idea arrant offens nonsens inher fallibl tendenc tragedi human relat gener sexual relat natur degre fallibl tendenc tragedi determin peopl sincer seriou effort relat work sure cinemat authori geniu convei man behav alexandr hate miser women insist expect love man alexandr disappoint bitter watch la maman la putain histor interest pass cultur human interact post parisian milieu restrict antisoci type mistak believ record gener relev human film jean renoir martin scorses argu",negative
"crew zombi chronicl read advic gui br br twist endingtyp movi good idea insert closeup death movi open credit spoil twist br br produc shoestr fair work miracl budget hire peopl walk talk gestur time joe haggerti youbr br set movi prop costum timebr br twist suppos surpris sure twist sens signpost reveal introduc charact great ideabr br kudo gui honesti hadn tbr br zombi completist",negative
"idea femal turtl knew tmnt brother teacher splinter enemi brother great artist leonardo michelangleo raphel donatello venu plai tmnt seri better venu femal turtl will add action stori stori tmnt knew enemi good point action femal turtl weak point action tmnt seri charact knew femal turtl",negative
