"storylin max von sydow voiceov narrat hypnot protagonist audienc protagonist young american ideologist leopold kessler jeanmarc barr arriv postwwii germani help rebuild damag countri uncl kessler ernsthugo reg suppli leopold job big zentropa train corpor leopold fall love katharina hartmann barbara sukowa daughter zentropa owner max hartmann rgen reenberg leopold find caught web corrupt advantag lose ideolog forc chose pest colerabr br mysteri mesmer manipul noirish haunt beauti ugli grandios descript mind lar von trier masterpiec europa final chapter europa trilogi usa retitl zentropa audienc wouldn confus agnieszka holland europa europa equal wwii drama europa trilogi consist forbrydelsen element epidem infam experi sold ticket danish cinema trilogi themat deal hypnot loss ideal theme trilogi essenti visual openingshot europa locomot move unidentifi narrat liter hypnot mental count ten will europa ten ten metaphor movi abil transport subconsci dreamrealitybr br europa util strang extrem visual style famou russian director andrei tarkovski trier maininflu blackandwhit movi occasion intertwin red form blood red dress rumor inspir steven spielberg shindler list coincidenti wwii drama trier socal dutch angel reinvent backgroundproject ad separ shot cooper layer layer hollywood movi incorpor econom reason trier artist reason carefulli execut strangelook visual techniqu underlin dreamreal hypnot univers europa real europa critic weigh advanc techniqu multilay backgroundproject plot charact hei review critic stanlei kubrick visual masterpiec space odyssei nowadai hold obligatori place cinemahistori booksbr br europa accus histor incorrect trier assign nazi werewolf terroristgroup histor signific onlinesourc correct fascin subject googl ing trier purpos educ portrai histori accur europa neverend nightmar leopold kessler hypnot univers audienc encount distort realiti equal memori deceiv accur reconstruct lie young audienc experi europa young memori wwii collect memori bbc documentari small inaccuraci serv purpos inform postwwii germani leopold memori itbr br three europa trilogi chapter portrai young ideologist nobl intent forc corrupt lose ideolog innoc ambigu forbrydelsen element europa ideologist forev caught hypnot realiti shoot europa poland lar von trier cowrit niel rsel extrem interest wwii pack extrem beauti shot catch atmospher timeperiod spoton great exampl polish church europa shot poland econom reason europa space odyssei europa will receiv rightfulli deserv place cinemahistori method twist filmnoir loveaffair clich visual techniqu uniqu strang complet will hollywood nowadai dreamfactori matterbr br europa essenti movi lar von trier catalog write pure commerci specul catastroph trier classic semiclass forbrydelsen element tvseri riget dogvil uniqu experi trier care actor dogm manifesto watch count ten",positive
"hilari typic naughti sister funni term pretti funni unintention sister bad boi bad pinup pose salaci comment er marilyn monro sensual lip bad otherbr br three sister plai starlet man stumbl live plai john bromfield careerbr br todai mainstream softcor porn market well cours raciest timebr br girl wear forget femal audienc member bromfield shave electr razor fetish barechest sop wet swimsuitbr br real plot girl famili curs prone suicid dramat death suicidebr br movi bad drivein wrong felt typic male audienc primari target women scantili dress resembl lurid cover mag polic detect jacket dime novelsbr br gui central focu movi girl love audienc meant alsobr br lot fun term",positive
"indian director tough compet movi laggan henpeckedcastr male defend villag half certifi idiot devda hapless fedar festoon foreign return drink oblivion charact endless corridor oblivi feel sentimentsala live ornat squalor red tapestri pageantri good movi tightrop walk appeas frontbench quentessenti gaper mesmer split skirt dishumdishum fight prefer involv nitwit bollywood lead actor margin handsom connect director tale leonin villag head defend villag consid violent movi masculin male audienc actor convei anger patho nana patekar narasimhan nana patekar courtyard watch beret mock politician loyal admir burst laughter word satir thrown daughter bath grandsonthi authent scene rural india nana patekar essenti actor belong school disappear breed hindi film violenc depict intric storytel songdanc thrown gawker movi won sell sad true state affair faster chang better bollywood good movi",positive
"good drama appear blank area leav viewer fill action imagin life read write film simpli smack real wife suddenli sole support livein rel quarrel troubl child knock typic drop school jackass husband nest egg bui beer thumb",positive
"fashion charm movi locat great situat time preston sturgess movi fi watch movi demand sit relax good michael rispoli rounder sleep rest cast fun peopl marri meet love weekend plan sound kooki fun watch will girl friend hug leav",positive
"disagre movi br br love movi sweet funni warm heart prove love friendship destroi br br stori excel thumb br br yeah prove deepest dream true tear tearbr br love movi person suck will shame delight movi glad peopl",positive
"emilio miraglio red queen kill time perfect exampl giallo mix requisit element sinist stew paramount complex twisti plot ultim perfect sens killer complet left field stori concern seri gruesom murder film titl place fulfil ancient propheci concern sister involv murder redcloak figur insan laugh madwoman frighten memor great giallo requir love lead actress assort head ridicul beauti barbara bouchet sister earlier role sybil dan lust tramp barbara fashion hous ingredi superior giallo catchi hummabl score bruno nicolai film stai dai gorgeou sceneri check film wurzburg germani pictur treat ey murder gialli well pleas report viewer well satisfi knife shoot impal carnag film tastefulli dish outnot mention crypt freaki dream sequenc rat bat lot em drug refer rape scene obligatori red person ugo pagliai hunki lead man femal viewer perfect giallo better dvd fine folk shame gorgeou print load extra boot gui",positive
"year ago friend friend video michael mann film heat finish movi stand film tough cassett envelop owner write glu seat distinct open lack creditsbr br hour sat wonder heard masterpiec beforebr br film europa lar von trier woke film noir dead deconstruct realiti intention obviou set haunt postwar german photograph tricki cutsbr br stori hardtotak moral odyssei happi young american pacifist german descent postwar germani intent good pai bomb countrymen drop meet distrust selfdestruct defianc hire zentropa diningandsleepingcar compani model mitropa owner nazi collabor occupi whitewash hero fall love daughter turn member werewolf nazi postwar terrorist understand european rage blow railroad bridg train savedbr br final note histor correct real werewolf film impli final nazi propaganda coup ss unit assassin major alliedoccupi aachen month capitul nazi announc creation legion saboteur terrorist will readi fight werewolf hitler youth receiv train three time deploi murder suspect communist forcedlabour foreign bavarian villag imprint fear inhabit hitler death war fell apartbr br werewolf propaganda profound occupi fear werewolf suspect seriou accid ignor pseudohistorian exampl ga main explod polic hq bombedout bremen soviet militari command di motorbik accid berlin strongest soviet arrest ten larg children preemptiv suspicion werewolf close prison camp lot di",positive
"movi year haunt br br favorit film mention film work art film dark citi break wave touch place place protect hidden sensit lifelong impress viewer lifechang event seriou relationship death friend film shook left emot hangov dai",positive
"kudo cesar montano reviv cebuano movi panaghoi sa suba good drama action romanc scene will laughbr br stori origin love triangl fourcorneredlov japanes occup rebellion american lord cool origin languag bisaya filipino nipongo japanes english americanbr br movi will year best pinoi moviesbr br watch",positive
"yeah poster horribl piec workbr br thought movi oknoth outstandingi hope hardcor druggi total trash lifebr br ahh happen rich kid son wealthi businessman hold big ballroom parti nice manicur lawn front mini mansionbr br noth kid good life total trash will drive brand suv will law school br br poor rich kidsin quaint pretti hous ivi leagu school ultra clean socialit partieswhat will br br hope addict drug passawai life jailso movi revolv poor rich boi girl surreal",positive
"favorit christma special releas vh dvd rpm lostand cassett long gonebr br big john denver fan impress music tradit favorit muppet spin esp st nick song origin br br timeless feel hope find copi",positive
"peopl expect brilliant steven spielberg direct movi movi movi love box offic glad movi dollar bad charact fun anim clear fuzzi music modern unusu anim movi professor screw ey scari ciru scari kid target audienc movi thought happen creepi professor dark kid movi movi fun enchant classic love dearli year",positive
"critic review class qualiti movi critic action film succumb matrix style film europa breath fresh air film layer view understand appreci outstand film lar von trier style film produc marvel cinema build drama tension project film arous enhanc charact focu convers colour black white scene hitchcock girl red coat grab attent enhanc drama scene commentari superb hypnot maintain focu central charact scene actionsbr br talk agre push film categori heighten drama film film bui notbr br artist noir film great film director",positive
"good movi good music good background accept plot main point movi tend man best actor idia turn dust gold nana patekar second best perform parinda disagre movi man will disappoint youbr br good movi shahrukh luxuri movi movi hard reach height skin man elasebr br movi cool music direct excel plot bit thin screen plai dialog good watch",positive
"liter movi creat knowbr br rule thumb imdb movi rate highli exampl piec kanneskompetitionkrownedkoreankraap call oldboi bad rare movi worth watch rate movi worth watch disgracebr br true protest movi perfect true rate flaw belafont script wander greatest director time czech jan kadar direct greatest actor time belov largerthanlif mostel sublim ida kaminska actingpoeticmor tour de forc pair heaven true movi flaw apart pander averag audienc interest watch excel critic movi incompar director shop main street best movi holocaust silli imdb rate system decid american beauti better angel levinebr br",positive
"good stoog shortchristin mcintyr love evil time onesh great actressth stoog good shemp larrythi good watch autumn time",positive
"soso romancedrama nice gener nice feel hallmark hall fametyp famili film sleepingbeforemarriag consid normal behavior consid star jane fonda robert de niro expect lot rougher movi languagewis br br memor film portray difficult learn read write adult big theme movi involv touch scene honest film memorablebr br fairli mild nice tale happi recommend",positive
"rent accident movi box thought rent find watch absolut fantast wonder movi top three favorit time recommend everyonebr br stori enjoy easi follow easili mess actor director great job keep togetherbr br actor fantast displai wonder charact terrif job br br gotta find copi",positive
"power masterwork provid anthem baba reili fool film group transit mod rocker biggest live band sbr br daltrei frontman entwistl steadi br br moon great check ongo convers drum tech plai side saddl whilst bass drum head replacedbr br townsend enjoi occasionallybr br consid stage crowd asleep br br band dai produc set tight difficult imagin band todai produc concert year time will enjoi",positive
"europa zentropa visual stun film blend grayscal colour photographi seamless true feast ey pictur contend golden palm canner award barton fink coen brother film stylist zentropa exercis class rent film judg",positive
"couldn comment moviebr br read aw opinion movi wonder view movi didbr br view incred actress director fantast job moviebr br hadn pleasur actress couldn set incred job believ movi long time br br problem deanna choic drug attempt suicid scene comment sound actress choic stupid choic understand movi written direct actress error fail real believ movi recommend opinion bad close mind hope actor plai great rolesbr br busi philipp will highest paid actress somedai hope laugh face critic girl",positive
"keen watch hong kong movi fail meet expectationsuntil burn paradis flat humor hk movi second rate stori drag film stori complex scene fill intellig space trueli intellig martial art film crouch tiger hollywood involv true hk movi incred fight scene movi onewhich coolest short main scene mind lot blood flow peopl cut half decapit product pretti good special fantasi writer fulfil shot pretti technic notic sheet paper throw pin wall yep tsui hark john woo favorit hong kong film ringo lam sure hell check director ac",positive
"break heart movi appreci underr peopl forgot movi nowadai bum bum movi fun watch popcorn friend transform movi orient hyper mega high budget mln higher special dumb movi storylin kind movi despit cours fun watch greatli cgi gain essenti kind moviesbr br honestli perform excel busi philipp alongsid erika christensen victor garberwhom respect movi oscar worth emot perform busi philipp astonish shame oscar hand deserv",positive
"johnni june carter cash financ film tradit render gospel stori music great real feel jesu june mari magdalen passion cash narrat good toobr br butbr br actor plai jesu miscast edg stori cash faith base music uncompel doubt distribut againbr br love bui cdbr br tom pain texa usa",positive
"tim krabb prais author het gouden ei novel screen spoorloo vanish dutch writer work de grot psycholog thriller total men egon axel meet youth camp surpris friend dear life egon quiet dull person spend time studi write geographi book axel hand charismat partyanim heavi drink crimin everydai concern woman bedroom moment meet axel strong influenc egon envi good life read thick book egon ultim egon drag egon illeg practic lead fatal drug transport distant asian countrybr br read book year surpris critic posit opinion book suffer complex structur krabb stori absorb portrait uncommon relationship peopl plot puzzl episod chronolog success scene seldom episod stori feel surprisingli remot charact background care complaint fact main charact egon axel stereotyp egon dull intellectu axel exact opposit real life onedimension peopl rare exist book film lot credibilitybr br despit film pleasant surpris better book adapt excel beauti cinematographi humour fedja van huet egon dutch actor forget opinion highest actor achiev drawback film book charact onedimension predict annoi guess wrote script krabb obviou talent director movi clear hamper defici screenplai koolhoven chosen better bookbr br",positive
"busi amaz love word freak geek dawson creek white chick smoker time room dai big fan lot fan israel excel movi waist time recommend movi busi late night conan beauti cute love movi room scari real life beauti half nude pictur stuff magazin maxim good daniel",positive
"seldom short comment written imdb filmgoer lightweight dark comedi entertain pleas depth watch incentivebr br happenst french le battement ail du papillon serendip fate event culmin seri random happen call life feel random fatedbr br happenst film occurr minor knock leav lettuc truck major base major life decis accuraci stranger toss pebbl incid event well pictur domino multipli charact averag stretch imagin accept remot chanc scenario happen diagnosi life magic cinemabr br admit fun watch writerdirector weav unrel event stori enmesh live french citizen coupl hour whimsic escap place recov surgeri will engag stitch heal br br happenst will award winner develop cult stranger thing happenedbr br soren kierkegaard attribut life understood backward live forward detail life experi meet love find perfect gift auto accid find seri seemingli random event lead itbr br answer forgot bring existentialist explain happenst",positive
"video store brows dollar rental gem gut instic wow rightbr br stori center girl surviv school shoot girl alicia teenag rebl wit full attack deanna survivor surviv bullet head miracl thrown fate slowli pain beauti displai heal move onbr br hate amaz movi fall crack wow perform busi phillip erkia christensen mention rest cast complaint dvd sore lack special featur jump cut movi kind jar excel movi",positive
"film movi consid favorit year gospel road watch young teen opportun watch favorit fact br br jesu blond br br supper huge mealbr br plai childrenbr br death peopl timebr br movi theolog sound high qualiti touch heart time johnni cash fan brave ventur dvd will purchas pure sentiment reason",positive
"review spoiler watch movi idea happen review movi spoilersbr br watch movi reiter best movi real translat beat butterfli wing oddli translat titl suppos thought american wouldn chao theori read jurass park movi base chao theori small event affect outcom seemingli unrel event lead event movi whirlwind wondrou follow chain chao intertwin charact inevit despit perfect time brave bad oversea gem hollywoodbr br",positive
"structur total book tim krabb wrote origin vanish spoorloo feel koolhoven style businesslik lyric great middl fine sting surpris emot read magazin sex film beautifulli explicit lot warmth humour shame american film open honoust dutch film tend edg subject de grot stai boundari good tast de grot amaz stori stretch year leav cinema move film film",positive
"exactli great film admir writer director film main theme fate small seemingli insignific thing greatli chang futur wai remind film slide door focus random event seemingli random stuff repeatedli help build cute conclus odd bald gui understand talk scenelik sort omnipot absolut explan film gui fight clock tower hudsuck proxybr br dvd jacket audrei tautou capit success ameli actor film star role pace brisk fine conclus bad reason score higher charact bit uninterest movi tighten subplot",positive
"grate cesar montano crew reviv oncemoribund visayan film understorei panaghoi hopefulli forerunn resurg vernacular claim speaker tagalog dialect lifestyl detail accur reminisc region philippin downsid corni stilt american antagonist item appreci lack authent period costum charact bright red kitcar suppos meant pass roadster small glare detail panaghoi ve ratingdaghang salamat manoi cesar addendum film sure beat pequ gallaga oro plata mata provid view visaya second war alo cinematographi hark spielberg color purpl storylin reminisc noli tanger",positive
"film renew interest french cinema stori enchant flawless audrei tautou absolut beauti imagin will lot state upcom role ameli",positive
"mysteri delight small comedi ignor critic fail find audienc deserv simpli showcas bud talent audrei tautou gener greater recognit cognoscenti br br lack pretens reli quirki character rumin interconnect human behavior manag amus life affirm critic acclaim competit genr tast entertain",positive
"instal notori horror seri woman kidnap gang blackclad men tortur dai final kill hersh beaten savagelyspun chair endlesslyha finger nail pulledanim gut thrown herhot boil water pour final eyebal punctur needler sick nasti sceneth maker unforgett tortur real closest thing snuff film commit murder tapeof cours special poor idea snuff pretti gruesomei flower flesh blood gori sadisticbut disturbinganywaythi mustse horror fan",positive
"heard movi purchas flick snuff told devil experi better natur ahead order guinea pig box set interest hear charli sheen ban movi second interest peakedbr br devil experi short film stori charact develop men tortur woman minut tortur wai beat spin circl forc drink alcohol forc listen hipitch nois hour smash hand mallet burn maggot burn throw gut ultim shove sharp needl eyebr br lot movi fake beat scene well gross scene woman spun circl dizzi watch scene forc listen sharp nois hour pain worst ey scene shutter watch simpli thought damn pretti good low budget movi enjoi flick recommend horror genr offer",positive
"shemp short stoog exclud earlier vaudevil year team threesom comed time hone best intens slapstick scene subtl funni watch larri shemp camera snapshot watch real object prompt moe exclam ohhighli polish mahoganybr br emil sitka bewild goofiest goon scari funni frustrat perplex stoog regular peopl shortsbr br shemp aficionado episod won disappoint",positive
"dead bodi nice movieit decent entertain pretti funnyther clich stuff freshat good allwhen start outif minut thoughth movi start interestingthi film wasn burst laughter hilariousand wasn gosh wonderfulit movi sit enjoi enjoy wasi movi badit rate bit lowi ve dealt alsogiv movi disgracefulit pretti goodand horribl peopl",positive
"short movi year ago watch sequel best popular watch guinea pig great gui sequel excel special chanc watch",positive
"lar von trier europa worthi echo third man american postworld war ii europ find entangl danger mysterybr br jeanmarc barr plai leopold kessler germanamerican refus join armi war arriv frankfurt war work uncl sleep car conductor zentropa railwai war secretli underground terrorist group call werewolv target american alli leopold side drawn seduc katharina hartmann barbara sukowa femm fatal daughter owner railwai compani father nazi sympath pardon american colonel harri eddi considin help german transport system colonel enlist forc leopold spy choic chanc werewolv carri attack trainsbr br leopold stuck adventur involv side conflict mysteri film noirish amaz watch naiv leopold deal lover terrorist colonel annoi passeng disgruntl uncl railwai compani offici examin work ethic final boil humor violent control film endlessli unpredictablebr br film stylishli shot place night winter lot fall snow shot black white shot color randomli appear background screen displai imag counter imag front add max von sydow hypnot narrat europa dreamlik place worldbr br person favorit film mine",positive
"fair dramalov stori movi focus live blue collar peopl find life loveth good film fail cinematographyscreenplaydirect editingth storyscript averag bestthi film will enjoi fonda de niro fan peopl love middl ag love stori coartship wiser cautiou levelit interest peopl interest subject matter illiteraci",positive
"gotta start furlong gotta god bless kid buck charact plai film real life onelin blow snot subtl humor script trial gui year furlong perform good madsen keep bet gui real life madsen natur vosloo move typecast mummi gui biggest surpris film jordana spiro perform reaction spoton film battl hot realiz br br big fan shoot em outhostag type film fan film lot twist turn keep guess standard robber bank kill hostag good gui win type film twist keep comingand comingbr br caf scene work best handheld cam gloss bit bourn ultimatum lite style scene caf br br bo bice fanat actor curti wayn plai karl will doubl gui twinsbr br watch wonder actor foreign accent small town sens peopl smuggl stuff countriesst accent reveal bonu featur produc film intern audienc star heard smoke hot moncia dean",positive
"room surpris comparison movi written columbin high school best room school shoot aftermath commun town movi focu opposit charact aleciabusi phillip deannaerika christensen alecia outcast wit entir shoot emot deanna popular girl surviv victim alecia forc visit deanna hospit order graduat polic investig alecia shoot happen alecia deanna eventu develop mutual understand friend style breakfast club room beautifulli power close turmoil school shoot recommend film",positive
"peopl forget king kong ripoff congo king kong godzilla king kong ripoff yeti stand borrow element king kong anim attract femalebr br yeti myth base bigfoot king kongand archeologist fascin time existbut scientif data prove itbr br movi hard find worth watch time watch elvira mistress dark earli chill spine kid yeti mad abc yr ago appreci good time stori involv mute boi dog evil businessman person kill yeti purpos music pretti coolit yeti br br gianfranco parolini yetian creat great monster atmospherebr br vote half",positive
"read commenti decid watch moviebr br cast special michael madsen tamer karadagli good enoughbr br filmveri intellig interest cast lot intern special european actor actress turkei russsiabr br secondstori basic guess interest action good plai opinionbr br thirdfin chapter special interestingit regular action moviesbr br finallyi recommend watch movieand hope love enjoi",positive
"intens fear hospit medic stuff skin pardon pun piec brave afraid top satisfi term reveng movi find feel lot hatr screwer lot sympathi screwe felt cring feel pang disgust junctur rare delight thing jade horror viewer reminisc hellrais tribut imit heavi hand piec offer viewer consid enjoi assault film awhil piec bring appolog lot watch whilst eat pud",positive
"bromwel high cartoon comedi time program school life teacher year teach profess lead bromwel high satir closer realiti teacher scrambl surviv financi insight student pathet teacher pomp petti situat remind school knew student episod student repeatedli burn school recal high classic inspector sack teacher student bromwel high expect adult ag bromwel high fetch piti",positive
"hous game strong stori obsess illus plai big psychologist offer help patient gambl debt caught gamebr br felt fascin danger wrong watch pursu urg sit edg chair trickster trick victim turn perpetr sure exactli moviebr br qualiti drawback script movi feel stori lack bit consist compens excel psycholog developmentbr br definit best movi gambl",positive
