"rich tycoon kill plane crash spinster twin sister martha craig madg kennedi grab control suicid dive selfsnuff famili three beauti daughter couldn care pilot jim norton john bromfield work valeri craig kathleen hugh coerc help wrest control estat troubl sister lorna sara shane famili lawyer jess barker valeri norton seduc lorna fend advanc sister nymphet vicki marla english plan thrown tailspin norton fall prei bet woe includ corpor chicaneri seduct suicid blackmail murder plot mann doublecross disfigur poetic justic befal craig manor impos mansion bluff overlook seabr br preposter potboil perfect second featur written wind dougla sirk saga power powerfulli dysfunct oil clan inspir nighttim tv serial dalla craig lowbrow excurs insan sin sistersoap dynasti three sibl bad great beauti kathleen hugh cartoon villaini stand valeri relentless quest inherit famili fortun unbridl enthusiasm evil movi guilti pleasur teenag sister vicki piec work well reminisc carmen sternwood big sleep meet pull equival sit norton lap stand graduat summa cum laud embrac whewbr br three bad sister produc schlockmeist howard koch terrif trashwallow exploit excess cast bmovi heaven marla creatur english hunk john reveng creatur bromfield marri french sexpot corinn calvet univers starlet sara shane discov hedi lamarr jess susan hayward barker kathleen outer space hugh silent screen star madg kennedi futur eurotrash star brett halsei trumpet apocalyps vicki victimsbr br bmovi rate marla bodi english marvel movi three bad sister big screen palm spring film noir festiv juri wipe soap sud aw hell noir noiromet",positive
"entertain gospel johnni cash adorn black cours sing lot narrat bit johnni cash film enjoy note blond depict jesu workjust fun jewish men blond hair fun greatest stori",positive
"entir sure rob schmidt qualifi master genr horror direct horror film call wrong turn mediocr fact die best creepiest episod entir second season master horror franchis underdog stori season william malon best episod fair hair child long featur film fear dot hous haunt hill suck pretti badlybr br stori die cleverli pick nowadai pipe hot social debat euthanasia thankfulli featur multipl oldfashion horror theme ghostli vengeanc murder conspiraci pitch black humor comic book style violenc whilst drive late night discuss husband continu adulteri addison coupl involv terribl car accid cliff walk wreck unharm wife abbi fulli burn aliv artifici whilst cliff sleazi attornei corbin bernsen dentist plug plug sue car constructor abbei mum set giant media campaign keep daughter aliv veget blame cliff abbei hate spirit reveng kill cliff surround fatal experi medic devic victim cliff realiz safer keep wife aliv remain aliv well die stupend episod exactli type stuff hope tvseri concept master horror violent gori sick twist sens humor load sleaz sequenc euthanasia theme obligatori media circu surround process script well unnecessarili revert polit standpoint moral lesson atmospher suspens kill sequenc suitabl nasti unsettl actress julia anderson robin sydnei pretti face impress voluptu rack corbin bernsen final offer chanc depict meanspirit egocentr bastard great moh episod definit highlight season",positive
"watch film time enjoi lindsai crous rest cast keep better better simpli marvel carefulli measur speech slow deliber action exactli placebr br great definit alltim favourit",positive
"rememb practic blank slate movi hollywood transit patriot war movi noir reel oater movi messag blackboard jungl waterfront folk improv mogul send messag call western union psycholog thriller entertain kind remot therapybr br pip three sister wrest control dead father estat worth redempt enlist aid compani pilot help keep rest famili bai initi buck eventu fall rest famili scheme sabotag romanc predict bit movi sexual tension sister subtl masoch hereditari insan thing meet parent screw cast practic unknown actor sound vagu familiar bad hard releas unit artist umbrella compani call belair product shot la night permit bizarr thought joke monei produc decid wrap middl scenebr br explain pile trash familiar term bad good phenomenon well hot rod hell fit love movi somebodi basement",positive
"well long year review final film panaghoi sa suba call river second metro manila film festiv expect well box offic artsi common moviego mmff season lot famili moviesbr br intrigu movi filipino english plai screen thought cesar montano good job star director great vision creativ help film lead star express wide rang emot requir film perform well young actress rebecca lusterio great job portrai bikai younger sister duroi hope film project futur ventur genr fact film local dialect help herbr br camera shot film well sceneri breathtak feel lesser effort complet differentbr br term stori feel writer delv live lesser charact film won rave stori film",positive
"work lot better mitchel malta spare sight joe don baker scenic mediterranean local clad ridicul cowboi outfitnot mention west gunsling mitchel mitchel film wouldn suffer lack gratuit polic brutal well comic comment mike bot enjoy fare episod mst imagin watch",positive
"memor classic touch romanc theme stress literaci modern societi devast career life consequ unfortun individu lack vital skillbr br stori revolv iri widow acquaint fellow employe factori job illiter cafeteria worker stanlei iri discov stanlei unabl read lose job read lesson kitchen cours predict initi wari involv develop feel otherbr br jane fonda compet plai iri woman problem cope job lack prospect teenag children pregnant unemploi sister abus husband robert deniro cours brilliant endear portray intellig resourc illiter stanlei bring digniti role command respect typic charm young yuppi coupl gener depict screen romanc ordinari work class middl ag pair pretti earth strugglesbr br won love heartwarm romanc person troubl issu adult illiteraci albeit perspect fiction charact",positive
"uniqu movi confus woman lindsai crous involv sharp con men joe mantegna oscarcalib perform slickest group absolut enchant hour mantegna crous rope con game stori unravel bit stand uniqu portray innoc caught dark definit worth shot",positive
"giant monster fan yeti absolut hear good ol bootleg market find copi pretti easili happili surpris watch flick dare decentbr br decent cheesi giantmonst flick kick pretti yeti pretti introduc charact consist sleazi good girl pretti downright strikingli beauti girl cheesi scifi film farbr br yeti longhair gui straight origin woodstock concert bad dude introduc kind funki cagelik thing godzilla despit rude awaken rampag rare destroi pictur kinda puzzl figur thing yeti understand english pretti nice copi dub english good gui bad gui arebr br giant yeti thing pretti movi typic lowbudget fashion chang size lot depend scene bunch fake leg shot stand therebr br special greatest definit good scene yeti smash warehous well window build ladder step climb top shatter window foot shock occup insid sequenc better bad moviebr br yeti stoop low ap time close genuin silli beauti girl yeti nippl erect lift eyebrow yeah babi manner bad kinda laugh viewerbr br movi pretti long kind thing surprisingli bore stori good watch utterli gorgeou actress screen will male viewer happybr br yeti upper echelon giant monster flick definit better king kong ripoff ap queen kong",positive
"well time hope standout episod season entri drab hohum entri episod turn well funni director rob schmidt bad wrong turn credit writer john esposito script chore includ tale mummi graveyard shift best written thought provok episod season die treat stori cliff abbei start episod coupl convers abbei caught cliff cheat desper win speak find car accid cliff left scratch bruis abbei thrown car catch fire spark ignit gasolin drip catch fire setup peopl hospit cliff decid abbei live state skin nerv reflex side time flatlin abbei walk ghost troubl sort peopl hand best episod season rank top episod gruesom taut script threw twist suspens palpabl touch die live forev",positive
"suppos brilliant thought provok film review compar review horror cinema film wasn meant convinc low budget ipecac aim meant blow viewer sheer shock flaw visual notic origin vh version br br high score reach goal downright horrif nonshock sens sick thoroughli paranoidpessimistici trust week wake strung tortur",positive
"busi phillip hell perform comed dramat erika christensen good busi stole nice touch smoker movi star busi great busi doesnt nomin kind film disast forget mona lisa smile room",positive
"lar von trier europa extrem good film von trier styliz stori europa film experi small televis screen trick opinion film complet real move piec cinema film top list scariest gothic complet film good favorit final scene harrow scene",positive
"famili stori told young girl grandfath brought life year foretoldbr br peopl murder blood spill rat scamper nake bodi enjoyedbr br kitti barbara bouchet suspect killer franziska marina malfatti evelyn death reveng plot steal inherit color superb thriller emilio miraglia giallo knowbr br thing spoil film appear frame cut call polic suddenli save kitti",positive
"movi wasn special thenbut year time funa lotbr br best film yeti bodi languag special alsobr br wanna watch movi wait hollywood blockbustereven film approx dollar br br copi itmovi video version wellbut cinemasbr br watch itenjoi ityeti",positive
"flyer rent movi gotta good front script cast director photographi high product valu prove eva longoria parker head shoulder romcom bad actor kate hudson jennif aniston call da thunk itbr br parker isla fisher class regard hold project good dead bodi lake bell excel time final paul rudd shine good movi lesser filmsbr br movi closemind male bad imdb review lame gem hack write br br depict contemporari la california gener scene bright beauti clean outstand movi la good talent lot care moviebr br won divulg plot longtim hardcor atheist suspend disbelief bui supernatur theme order enjoi excel lightheart piec entertain remind topper movi enjoyablebr br movi expos popular hacknei movi ghost mediocr overli sentiment crap fest public tast lean heavili mediocr save prais worthi howeverbr br enjoi overlook gem night michel pfeiffer jeff goldblum clu gulag blind bruce willi kim basing american dreamer jobeth william chanc robert downei jr christoph mcdonald cybil sheppard john malkovich enjoi br br firstrat job kinda hard straight gui pretend gai year plot devic detract movi excel",positive
"whimsic film misfortun releas time highli popular ameli wonder audrei tautou plai central role laurent firod talent director enjoy film franc memorybr br film deal chanc english titl indic french titl refer butterfli wing creat chao atlant fly well hurrican pacif believ color insect start director interlac charact film connect hard imagin film context work wellbr br chanc meet metro set tone film iren work woman sit opposit zodiac sign proce read paper iren will cross path will find soul mate dai iren leav train quiet young man seat woman birth iren destin start ala will reconnect frame filmbr br audrei tautou wonder iren faudel plai youn lot presenc plai well talent young cast valuabl contribut success film light butterfli wingsbr br forward futur film laurent firod appear director heart place ear human connect",positive
"complet contrast opinion review film surprisingli good reluctantli expect bore clich obviou joke overact trailer promisedbr br minut genuin laugh enjoi refresh toilet humour gag dead bodi manag realist funni scenario spoil moment involv anim hilariousbr br stapl ingredi good film script director actor compar attempt romant comedi film stand tallbr br sure learn spiritu awaken open mind will good time",positive
"film crappi brate movi surpris amus eva good lake bell stole amaz comed time joke film surprisingli origin funni flat joke plot tie woman eva di dai haunt woman wastob husband sound farfetch work well br br worthwhil cinema watch dvd",positive
"rumor memor entri wartim seri instruct cartoon star privat snafu film aim servicemen direct anim score top talent warner bro termit terrac includ friz freleng chuck jone carl stall invalu mel blanc suppli voic snafu stori rhyme narrat film suppli theodor geisel dr seuss idea convei basic concept humor vivid imageri charact snafu perfect neg exampl dope twerp suppos chuck jone script approv pentagon offici armi brass permit anim unusu amount freedom concern languag bawdi joke theatric censorship time allow greater good coursebr br titl indic cartoon illustr damag power rumor set armi camp privat snafu sit soldier latrin won hollywood film era casual convers start ball roll observ offhand remark bomb misinterpret exagger turn increasingli frighten rumor sweep camp imageri vivid brain anxiou soldier depict percol pot fever speech render steami hot air balloon juic soldier shoot mouth cannonstyl actual balonei fly direct wing balonei panick soldier brooklyn bridg pulver conei island wipe enemi troop land white hous lawn japanes california visual surreal nightmarish camp quarantin rumor privat snafu lock pad cellbr br highli piec work filmmak dramat theme wit startl energi messag valid year catastroph event real imagin breed kind wild rumor spread rapidli commun advanc technolog improv privat snafu time broadcast balloon juic email cellphon blog consequ rumor rare exampl wartim educ film essenti messag feel fact time",positive
"dogma lar movi art stori beauti paint love death favorit movi time color music perfect",positive
"fortun real mccoi fan babi boomer grewup late three adult actorsactress appear reunion toni martinez richard crenna di shortli enjoy luke sugarbab pepino equal mysteri complet absenc mention lydia reed michael winkleman understand luke pass sure hassi internet find curiou mention conspicu absenc reunion suspect famili michael lydia aliv request left discuss desir grant tnn find trace michael lydia rest vanish safest polici leav convers togetherbr br retrospect walter brennen wonderfulli bone grandpa success rememb child mimick grandpa gimp walk parent laugh sure children annoy bother bit tendenc richard crenna domin discuss time interrupt toni kathleen point fact toni martinez complet capabl contribut convers allow speakout reunion unfortun hear three equal reunion real treat watch dvd time enjoi timebr br dodgerdud",positive
"beauti film evidenc great portray power mother love perform steadi execut innov script film stori indian woman nandini live canada husband shekhar kid raja sudden husband inform famili india troubl coupl rush india villag nanadini shock terrifi wit wild rural cultur shekhar famili rule cruel highli cynic merciless father narasimha live poor highli violent lifestyl full murder terror women subservi helpless nandini start nag shekhar return kill father enemi leav narasimha refus raja india start intens struggl call nandini narasimhabr br india posit light film tini minor rural area correct portray view fair onesid posit side extent horrifi sight film countri locat amaz music wonder krishna vamshi direct aid cinematographi good edit thing earpleas background score ismail darbar beauti charact well defin bright dark side portion film portrai realist film flow well interest fairli entertain watch dialogu superb intellig written shock proceed disturb point great deal posit moment manag reliev tensionbr br film biggest strength perform karisma kapoor breathtak believ nandini abil strike balanc vulner unrestrain emot simpli incred displai intens impuls anguish determin mother son kid son outbreak face nana patekar volcan erupt simplest women tigress child fiza power perform greatest actor indian cinema nana patekar indescrib narasimha manag hate narasimha admir actor plai patekar displai cruelti witti human total convict outstand great perform unsurprisingli india underr actress deepti naval sensitis charact perfect sanjai kapoor adequ shahrukh khan great comic relief watch shakti better definit mustwatch",positive
"basic exact movi hous wax vincent price genuin horror hit releas previou year serious care mad magician offer sheer thrill delight period setpiec joyou sublim perform macabr horror gimmick predecessor chang win team exactli writer crane wilbur thought pen price charact don gallico torment soul besieg fate vengeanc wrong don gallico perform illusionist gallico great plan exhibit greatest magic trick histori entitl girl buzz gallico promis solo career abruptli ruin previou employ ross ormond appear stage shove contract nose state gallico invent properti compani sleazi relentless ormond ransack gallico belov wife buzz trick program gallico rival great rinaldi inevit gallico snap sadist butcher ormond master creat disguis recreat victim imag start lead doubl life mad magician amus thoroughli unpretenti horror movi grand guignol style lot improb plot twist landladi turn brilliant crime novelist hand fantast grotesqu grossout moment remain delight film yoyo player goofi trick water fountain serv timefil contemporari hype fun watch properli behold mad magician interest period set point view event place time fingerprint start evid materi charact alic prentiss obviou refer famou crime author era needless state vincent price remain absolut essenti element triumph film well horror movi legendari man star actor accomplish price depict torment protagonist gradual descend mental mad indescrib mesmer piti don gallico time fear enorm support vile retali simultan realiz murder rampag death vincent price simpli geniu actor humbl opinion embodi horror genr",positive
"surefir laugh gag best stoog film shemp finest short comedi columbia produc director bernd origin wrote screenplai stoog curli howard suffer careerend stroke tailor columbia comedi team schill lane version releas pardon terror good stoog pass final film stoog br br man goodrich call ac detect shemp larri moe fear will murder arriv goodrich disappear niec assort goon rid stoog will find goodrich bring niec goon justic br br shemp funni film reaction mickei christin mcintyr superb trademark sound eeebeeebeeeb mcintyr notic laugh funni scene closeup moe camera len inthedark fight cast member involvedbr br nikko goon plai duke york unusu charact portrai stoog film kink hair pass stoog tower gem stoog film shemp diehard curli fan will enjoi true stoog classic",positive
"ringo lam film best film unusu ancient china period piec crank full kickass martial art locat underground lair full trap dungeon plai big charact action fantast stori tens entertain set design trueli memor sadli burn paradis dvd vh nexttoimposs mitt second biggest chinatown north america find pass",positive
"adult comedi cartoon south park format small adventur three teenag girl bromwel high keisha natella latrina explod sweet behav bitch keisha good leader small stori teacher school idiot princip bip nervou math teacher cast fantast lenni henri gina yasher eastend chrissi watt tracyann oberman smack poni doon mackichan dead ringer mark perri blunder nina conti canada good good",positive
"great love ha love dinosaur greatest anim love wasn copi origin ha good storylin great kid dinosaur great dinosaur mutat late yai great fantasi warn spoil spoil read plz kinda weird dang forgot nvm guess spoiler mind love opinion spell",positive
"movi good point fact movi isnt sweden denemark wrong case happi mistak notifi",positive
"sure movi sappi sweet full clich entertain watch movi entertain natasha henstridg stun short hair smile radiant beauti disguis michael vartan sure women love eacb film understand comment chemistri guess seebr br olivia abo michael rigoli fun watch abo british accent creep suppos bronx speech truth hadn notic read comment dvd dialogu sound british american ideal role br br stori nice peopl marri find soul mate stori movi suppos plai documentari unrealist drama screen hour tube watch escap humdrum daili live short time enter charact screen thought actor good job hei sentiment gui tear easili wrong sentiment scene movi plenti thosebr br save unseen super magnific movi will dai advertis movi channel lifetim movi note watch",positive
"flutter butterfli wing atlant unleash hurrican pacif theori chao theori sure exactli action matter small insignific will start chain reaction lead big event small jewel film seri seeminglyunrel charact pari action will affect live sixdegreesofsepar theori appli well stori facet jewel film finelytun nuanc audrei tautou lumin stori mesh plausibl humor viewer leav theatr nod agreement",positive
"releas movi dvd hallow place greatest film time ten twenti year critic film historian socal film vapid lar von trier revolution revit intern film masterpiec stand zentropa europa refer fascin artist view bleak psychot uncertainti ooz post wwii europ decim german landscap physic horror match damag psych peopl von trier brilliantli paint vision screen will feel watch lost espionag noir classic late perfectli light black white scene time feel brink cut edg scene assassin aboard train liter movi wit evolut art form br br reason von trier caught dogma movement shortli break wave dancer dark classic zentropa lift art film excit height ag fine wine beg dvd releas",positive
"complex film explor fordist taylorist mode industri capitalist product human relat constant refer assembl product worker treat cog machin overseen manag wield clipboard control hair worker leav expos fire worker stanlei meet criteria supervisor time hard worker good work unspecifi futur mistak br br system destroi famili stanlei send father nurs di stanlei lose job iri daughter singl teen mother drop high school job plant refer fact declin wage partner work implic left care kid iri husband dead ill multipl refer film cost medic care viewer wonder live better costli care iri brother law abus unsuccess dai unemploy offic wife yell bui beer save leav face lift andor teeth job work class stake convent bourgeoi notion perfect beauti bui refer race film black factori worker husband jail presum black black men suffer disproportion high incarcer rate remark time famili compos prison wage slavebr br stanlei believ human relat film system fordist capit care father spite fact father travel salesman job illiteraci reduc human relat pure instrument contract iri brother law marri wrong sister iri conform workeatsleep routin technolog techniqu industri product artisan creativ sort bauhau ideal dream earli modernist socialist bauhau technolog provid basic allow free time creativ human work fuller human relat tradit gender relat cook clean care famili iron iri hand live tradition male role factori worker main sourc incom extend famili bring stanlei public realm tradition offlimit women teach read write access knowledg tradition gender malebr br literaci metaphor tradition masculin public realm system circul monetari vehicular cultur enabl particip public realm access stanlei femin job open cook clean exclud regular circul unabl particip monetari open bank account vehicular driver licens ride bu social exist write namebr br learn read grab book auto repair farm spiritu bibl word god relativ plane howto book fact organ religion gener occasion bibl appear dresser camera pan find stanlei iri sex acknowledg moral forc iri clearli charact devot live good life mention film rosari object lost purs snatchingbr br read enter system land manageri posit health care plan car hous place head famili breadwinn presum industri design dream product will requir endur drudgeri assembl produc bit convent hollywood film incongru wonder wasn forc studio exec suddenli worri lack feelgood potenti bottom linebr br pundit comfort move postindustri capit film nostalg feel histor distanc analyz happen period br br highli recommend exercis brain disregard close perfect",positive
"room total surpris clue paid big time hold punch live chang disgruntl young man decid victim class mate innoc victim rash actionsbr br paul ryan director work edit materi talent man reward amaz castbr br alicia brown older girl graduat high school coupl year wave length student rebel punk lot makeup mouth will cut dare orbit alicia student room student di supposedli kill boyfriend alicia realiz wound girl terribl ordeal life clue effectbr br aftermath tragedi concentr young woman surviv deanna cartwright wealthi teen ager school ricochet bullet hit hospit wound dark period mind nightmar forgetbr br alicia hospit school princip cooper polic head school deanna terribl state will soften will author alicia dislik deanna matter dai girl will peac realiz sequenc happen horribl dai schoolbr br busi phillip excel alicia erika christiansen equal good deanna victor garber jame pinkin taylor holland rest cast plai ensemblebr br film intens explicit shoot occur help tone ryan movi",positive
"war ii messag soldier alli care spread rumor call instruct cartoon mixtur seriou messag funnylook main charact call pvt snafubr br imagin fear whathavey pvt snafu incorrectli add hear start panic kind disast spread rumor peopl includ lose confid countri point cartoon good lose war demor enemi todai br br lost war declar big balonei cartoon amaz american learn cartoon year sure relev todai write terrorist bomb europ todai peopl war terror bumper sticker slogan amazingbr br writer famou dr suess analog hot air balloon juic messag theodor geisel real rhyme will cleverbr br hilari wasn meant understand climat justifi paranoia war ii peopl forget war easili wound side win tens time",positive
